25, Lumini IT Solutions,engenheiro de dados senior,Trabalho remoto,3.4,https://www.glassdoor.com.br/partner/jobListing.htm?pos=130&ao=1136043&s=58&guid=0000018510b29fbf98c5b1b0602b1e36&src=GD_JOB_AD&t=SR&vt=w&cs=1_f3ba86cc&cb=1671022420146&jobListingId=1008331466637&jrtk=3-0-1gk8b57vakf27801-1gk8b5801im97801-97bed2117f790b73-,"UTILIZE A SUA PAIXÃO POR TECNOLOGIA PARA CAUSAR IMPACTO POSITIVO E #VemSerLuminiIT
Aqui na Lumini IT a inovação e a resiliência fazem parte da nossa rotina.
Somos uma empresa de soluções de TI que preza pela qualidade e agilidade na entrega de seus serviços.
O nosso grande segredo para estar sempre um passo à frente do mercado é a audácia e a transformação que cada LUMINER promove todos os dias.
Nossa integridade nos impulsiona e, o melhor, todo mundo colabora com todo mundo, não importa quem deu a ideia, somos uma empresa de estratégia horizontal, todas as pessoas estão dispostas a ajudar e se envolvem legitimamente para fazer dar certo e entregar resultados.
Esta posição é para a área de infraestrutura aqui da Lumini e consiste em componentes e serviços que fornecem a base para sustentar todos os sistemas de informação de nossos clientes.
Curtiu? Inscreva-se na vaga!
Responsabilidades e atribuições
Profissional sênior para implementar soluções de dados em Big Data / Data Lake / DW (modelo relacional) para que os Cientistas de Dados possam fazer seu trabalho de análise, segmentação, predição e prescrição.
Responsável pela coleta e preparação de dados, bem como construção de datamarts, book de variáveis e ABT’s, com automação dos processos garantindo qualidade de dados e atuando como vínculo entre equipes de TI, Analytics e áreas de negócio. Atua inclusive, com integração de dados estruturados com não estruturados.
Principais responsabilidades:
Atuar como engenheiro de dados nos casos de uso;
Construir aplicações de larga escala SaaS (Software as a Service);
Construir e customizar aplicações de dados em Hadoop e Spark;
Definir e construir banco de dados relacionais com arquitetura distribuída para processamento de Big Data;
Extrair, transformar e carregar (ETL) dados de um banco de dados para outro.
Requisitos e qualificações
REQUISITOS MÍNIMOS:
Formação / Experiência:
Graduação em computação ou ciências exatas. Desejável pós-graduação e cursos em banco de dados5 anos de experiência com desenvolvimento e preparação de dados, incluindo experiência com grandes conjuntos e volumes de dados; experiência com deploy de modelos de machine learningDesejável: participação em projetos de Telecom, conhecimento em dados não estruturados, APIs e streaming de dados, experiência no processo produtivo de dados (DataOps).
Idioma: Inglês e Espanhol são desejáveis, mas não obrigatórios.
Conhecimentos Específicos: Mandatórios: PL/SQL, Hadoop, CDSW, Spark, Hive, Python, PySpark
Desejáveis:Experiência com ferramentas de BI (QlikView, PowerBI, Tableau);Ecossistema Azure (Databricks, Cosmos DB, Azure ML)
Informações adicionais
Modalidade de Trabalho: 100% Home-Office;
Contratação: PJ;
Horário de Atuação: Horário 09h às 18h (Base 168h mês)
Obs: Feriados seguem as datas de São Paulo - SP
Benefícios PJ:

Bônus por alcance de metas;
14 dias de descanso remunerados por ano;
Day-Off de aniversário.
Importante: Nós valorizamos a diversidade e inclusão, consideramos todos os candidatos para as nossas vagas, independente de cor, raça, religião, gênero e identidade de gênero, nacionalidade, deficiência, orientação sexual, ascendência, idade, etc.
Com mais de 10 anos de experiência na gestão de ambientes de TI de missão crítica, a Lumini utiliza o poder da inteligência operacional para oferecer serviços de tecnologia acessíveis e de alto valor. Nossa abordagem ao gerenciamento de ambientes de TI vai muito além de bits e bytes. O que nos move é disseminar uma cultura de melhoria contínua em processos de negócios dos nossos clientes. A Lumini tem orgulho da conquista da certificação ISO 9001 e trabalha pela democratização do uso de tecnologias como serviços cognitivos, machine learning, monitoramento de informação em tempo real e data science, atendendo a empresas de qualquer tamanho que tenham o anseio e a pretensão de transformar os seus mercados.Mostrar mais Report","São Paulo, Brasil",De 51 a 200 funcionários,2007.0,Empresa – capital fechado,De US$ 25 a US$ 100 milhões,3.5,3.2,3.4,3.0,3.1,59,Tecnologia da informação,"todo informacao solucoes seguem vaga home-office hive 18h move nao desejavel vinculo projetos posicao abordagem ti construcao coleta anos raca conhecimento mundo conhecimentos mercados.mostrar beneficios analytics alto acessiveis distribuida 's bits requisitos exatas learningdesejavel audacia negocios book orgulho abt critica impacto formacao data carregar bytes cosmos empresas inscreva-se grandes estrategia lumini ( automacao integridade 10 gestao etc dar big sempre clientes pretensao sistemas day-off alem implementar areas integracao # pl/sql melhor processo nacionalidade tamanho dispostas atuando ? base processamento candidatos espanhol powerbi possam servicos estruturados luminer db continua trabalha paulo deficiencia legitimamente parte atua democratizacao vai feriados modelo aplicacoes cultura arquitetura horizontal ano sp valor dias analise sao modalidade service variaveis tempo % inclusive atendendo customizar metas frente genero empresa ! apis vemserluminiit etl experiencia escala bi oferecer - modelos idade 09h passo definir mercado vagas causar inclusao lake colabora cada importante preza disseminar predicao volumes resiliencia construir iso produtivo independente entregar monitoramento . participacao atribuicoes incluindo fazer mandatorios poder curtiu melhoria banco ingles streaming equipes garantindo engenheiro religiao aqui obs agilidade ambientes sexual science machine senior : conquista area bem telecom positivo deu ciencias spark envolvem missao alcance segmentacao pj aniversario especificos todas conjuntos desejaveis impulsiona ideia gerenciamento learning real graduacao consideramos responsavel anseio importa relacionais desenvolvimento remunerados cientistas fazem profissional atuar transformar utilize ascendencia utiliza obrigatorios todos saas python tableau cdsw ajudar operacional qualificacoes estao databricks casos extrair 168h responsabilidades 14 qualquer preparacao sustentar qlikview uso paixao prescricao grande 9001 100 inovacao contratacao dataops qualidade tecnologia trabalho pos-graduacao atuacao segredo software inteligencia dados5 negocio componentes diversidade dados ecossistema descanso mes report cursos computacao certo rotina pyspark identidade valorizamos informacoes azure pessoas , fornecem outro resultados consiste processos it transformacao orientacao / adicionais cognitivos horario idioma datas datamarts entrega promove dw ) tecnologias ferramentas bonus cor larga certificacao deploy relacional ml principais minimos ; infraestrutura hadoop",engenheiro (a) de dados,senior
26, Nelogica,cientista de dados senior,Porto Alegre,4.3,https://www.glassdoor.com.br/partner/jobListing.htm?pos=120&ao=1136043&s=58&guid=0000018510b29fbf98c5b1b0602b1e36&src=GD_JOB_AD&t=SR&vt=w&cs=1_43e74bf0&cb=1671022420145&jobListingId=1008329468463&jrtk=3-0-1gk8b57vakf27801-1gk8b5801im97801-b0bef8e454bc620f-,"Aqui na Nelogica, desenvolvemos soluções para o mercado financeiro e procuramos por profissionais que desejam fazer parte de um time de alta performance, que tenham vontade de ser os melhores em suas áreas de atuação e que queiram contribuir diariamente para que possamos continuar revolucionando o futuro do mercado financeiro!

Os principais desafios desta posição serão:
Acompanhamento e implementação de modelo de estatísticas de uso do software
Analisar problemas de negócio complexos utilizando dados de nível tático e estratégico
Identificar e analisar tendências de mercado, além de análise e acompanhamento da concorrência
Elaborar estudos e análises pontuais sobre o mercado financeiro
Realizar a exploração e mineração dos dados, evidenciando e descobrindo padrões.
Propor alterações pertinentes nos modelos atuais
O que é essencial que você apresente:
Graduação completa em Estatística, Economia, Engenharia ou áreas similares
Conhecimento avançado de SQL e R e/ou Python
Conhecimento do Mercado Financeiro
Experiência em BI/ Data Science
﻿
Você vai arrasar se:
Pós graduação completa
Experiência no mercado financeiro, tecnológico ou bancário
Conhecimento avançado em inglês

Informações adicionais
Também consideramos como diferenciais experiências complementares além da atuação profissional, como o envolvimento acadêmico (PETs, mentorias, cursos, competições etc), ou envolvimento em comunidades de sua área de atuação, trabalho voluntário entre outros.

Além disso, por aqui jogamos juntos para promover um ambiente cada dia mais inclusivo, que valoriza todas as trajetórias independentemente de gênero, orientação sexual, raça, etnia ou deficiência.
A Nelogica nasceu do sonho de empreender de dois amigos de infância, que, apaixonados pelo mercado financeiro e pelo universo da tecnologia, decidiram unir estes dois mundos, democratizando o acesso à informação para investimentos.
Hoje somos referência em nosso segmento, nos consolidando como a maior empresa de plataformas para trading na América Latina, impactando +1M de pessoas que utilizam nossas mais diversas soluções. Desenvolvemos softwares de alta performance com o propósito de transformar o futuro do mercado financeiro e nos tornarmos a melhor investech do mundo e já somos +750 Nelogicos construindo isso!Mostrar mais Report","Porto Alegre, Brasil",De 501 a 1.000 funcionários,2003.0,Empresa – capital fechado,Desconhecido/Não se aplica,4.0,4.1,4.2,3.8,4.0,84,Tecnologia da informação,"informacao solucoes diariamente juntos valoriza construindo tambem nasceu +1m ambiente evidenciando pets melhores . segmento realizar inclusivo essencial estatistica deficiencia parte posicao uso vai pertinentes modelo fazer procuramos bancario decidiram voce contribuir academico identificar performance raca utilizam conhecimento tecnologia independentemente tornarmos ingles trabalho mundo exploracao possamos padroes infancia universo latina profissionais analise softwares diversas tendencias atuacao descobrindo e/ou acompanhamento software aqui negocio mundos plataformas revolucionando dados apresente disso sexual report estudos ja science cursos dois proposito nelogicos problemas trajetorias implementacao voluntario : sonho +750 propor genero unir empresa utilizando ! area dia data informacoes outros maior engenharia futuro elaborar competicoes completa trading nivel experiencia comunidades pontuais pessoas , similares sql ( arrasar etnia time mostrar economia etc alteracoes tecnologico mentorias modelos todas desejam orientacao investech adicionais complementares envolvimento mineracao financeiro mercado referencia graduacao tatico alem desta consideramos diferenciais atuais areas vontade ) sobre promover empreender serao r melhor cada bi/ avancado continuar investimentos profissional estrategico analises acesso transformar desenvolvemos consolidando principais nelogica complexos amigos impactando analisar apaixonados alta estatisticas concorrencia experiencias pos queiram america jogamos python desafios hoje democratizando",cientista de dados,senior
27, Maida;Health,cientista de dados pesquisador,São Paulo,3.8,https://www.glassdoor.com.br/partner/jobListing.htm?pos=114&ao=1136043&s=58&guid=0000018510b29fbf98c5b1b0602b1e36&src=GD_JOB_AD&t=SR&vt=w&cs=1_8ab1dd5d&cb=1671022420144&jobListingId=1008320934914&jrtk=3-0-1gk8b57vakf27801-1gk8b5801im97801-c42a13e3bf218f9a-,"O que você precisa ter:
Ensino Superior completo ou em andamento, preferencialmente em Ciência da Computação, Estatística, Matemática, Sistemas de Informação ou áreas afins;
Experiência com Machine Learning ou atividades correlatas.
Desejável:
Especialização em Data Science;
Mestrado em áreas que envolvam machine learning ou áreas relacionadas;
Compreensão em estatística.
O que você fará diariamente:
Interpretar e transformar os dados brutos obtidos em informação para gestores;
Criar relatórios, paineis e visualizações para áreas gerenciais;
Coletar e tratar dados para a identificação de padrões e seleção de features (ferramentas) para maximizar os resultados;
Treinar de modelos de machine learning utilizando as melhores práticas e modelos para maximizar os resultados;
Analisar e discutir os principais resultados e métricas obtidos em experimentos ou no ambiente de produção;
Sugerir soluções para desafios encontrados na execução dos projetos;
Interagir tecnicamente com equipes internas e externas.
Trabalho remoto
Vaga disponível para todo o BrasilMostrar mais Report","Teresina, Brasil",De 201 a 500 funcionários,,Prestação de serviço,Desconhecido/Não se aplica,3.4,3.2,3.7,3.4,3.5,79,Não Informado,"todo informacao solucoes producao afins diariamente vaga superior preferencialmente encontrados selecao correlatas discutir ambiente desejavel . melhores obtidos sugerir projetos interagir estatistica mestrado atividades precisa voce visualizacoes tecnicamente trabalho ter padroes metricas equipes gestores experimentos dados identificacao report science externas computacao machine compreensao : criar completo matematica utilizando especializacao data paineis experiencia , interpretar ( relacionadas tratar ciencia relatorios resultados modelos maximizar internas learning gerenciais andamento sistemas execucao fara areas features ) ferramentas brutos coletar transformar disponivel principais brasilmostrar remoto ; ensino analisar praticas envolvam treinar desafios",cientista de dados,Não Informado
28, DEXCO,cientista de dados especialista,Trabalho remoto,3.8,https://www.glassdoor.com.br/partner/jobListing.htm?pos=226&ao=1136043&s=58&guid=0000018510b2c0289e6208656f1ca8dc&src=GD_JOB_AD&t=SR&vt=w&cs=1_84b9743e&cb=1671022428489&jobListingId=1008171474959&jrtk=3-0-1gk8b5g39ii27801-1gk8b5g3rgfrt800-4de7b34f25fef474-,"Buscamos um(a) cientista de dados especialista para o time de Data & Analytics.
Se você tem atitude de dono, acredita na liderança pelo exemplo e tem interesse em fazer parte de um ambiente colaborativo, que fomenta a inovação e acredita na diversidade, o seu ambiente é aqui na Dexco.
Inscreva-se e venha fazer parte da nossa jornada de transformação.
Com o propósito de oferecer Soluções para Melhor Viver, nós somos parte do dia a dia das cidades e da vida das pessoas por meio das marcas Deca, Hydra, Ceusa, Portinari, Durafloor e Duratex. Temos 5 unidades florestais (MG, SP e RS) e 16 unidades industriais no Brasil (MG, SC, RS, SP, PB, PE, SE e RJ), 3 fábricas na Colômbia e 100% da plataforma Viva Decora.
Responsabilidades e atribuições
Buscamos um(a) cientista de dados especialista para compor nossa equipe de BI/Analytics, que atende a todas as unidades da Dexco. A pessoa que ocupará esta cadeira será responsável por disseminar a cultura de Analytics, Machine Learning e IA dentro e fora da equipe, dando manutenção em projetos de IA/ML já existentes e capitaneando a criação de novos projetos junto às áreas de negócio.
Requisitos e qualificações
Educação e Carreira:
Ensino superior completo na área de tecnologia, estatística ou similares;
Cursos voltados à Machine Learning, Data Science e IA;
Experiência na área de Analytics;
Hard Skills necessárias:
SQL Avançado;
Python Avançado (para desenvolvimento de modelos ML/IA);
Aplicações anteriores em ML/IA de média/larga escala (comerciais ou acadêmicas);
Desejáveis:
Conhecimentos técnicos em PySpark;
Experiências prévias com Databricks;
Experiência no ambiente AWS;
AGORA SOMOS DEXCO
Ao completarmos 7 décadas de atuação, chegamos a um importante marco que nos permitiu viver um novo momento: a mudança. Somos, agora, uma empresa ainda mais moderna e, com isso, iniciaremos uma nova jornada digital que faz da Dexco uma empresa do século XXI: mais moderna e cada vez mais próxima do consumidor.
Deca, Portinari, Hydra, Duratex, Castelatto, Ceusa e Durafloor permanecem como marcas fortes e que partem de um único lugar: Dexco.
Esse movimento estabelece um novo ciclo de investimentos que nos impulsiona a continuar cumprindo com o nosso propósito de desenvolver soluções para melhor viver.
Somos a soma contínua entre a forma e a função.
No centro do que fazemos está a crença de que o design perfeito é aquele que torna a relação das pessoas com todo e qualquer tipo de ambiente mais harmônica e prazerosa. Seja em um ambiente de trabalho, de lazer, de descanso ou no meio ambiente como um todo. É o design que encanta, simplifica, representa, preserva e transforma esses ambientes.
Porque, para nós, ambientes existem para serem vividos.
Nosso Propósito é oferecer ""Soluções para Melhor Viver"" e, para isso, buscamos pessoas criativas, abertas ao novo, que saibam trabalhar de forma colaborativa, alinhadas com o nosso propósito e dispostas a trilhar uma jornada de transformação cultural. Por isso, estamos sempre em busca de novos talentos que queiram dividir esse desafio conosco.
Alinhado a nossa cultura, temos como objetivo tornar a Dexco um lugar mais inclusivo, onde os colaboradores possam ser quem realmente são e sejam valorizados pelas suas diferenças. Buscamos talentos com diferentes características e que queiram estar conosco nessa jornada de transformação!
Saiba mais em: https://www.dex.co/Mostrar mais Report","São Paulo, Brasil",Mais de 10.000 funcionários,1951.0,Empresa – capital fechado,De US$ 1 a US$ 5 bilhões,3.2,3.4,3.5,3.2,3.3,78,"Construção, reparo e serviços de manutenção","movimento todo hydra solucoes talentos qualificacoes permanecem trabalhar vez databricks abertas possam manutencao rs superior media/larga 7 responsabilidades moderna ambiente nova . qualquer continua inclusivo nessa projetos estatistica colaboradores parte realmente dono atribuicoes estabelece 5 fazer aplicacoes novo xxi cultura ia/ml voltados voce fomenta necessarias perfeito serem 100 inovacao ocupara existentes tecnologia diferencas objetivo trabalho conhecimentos sp viver brasil encanta analytics equipe ml/ia rj pe chegamos venha //www.dex.co/mostrar atuacao alinhadas sao aqui diversidade negocio comerciais requisitos ambientes dados relacao descanso % report compor ja momento dentro cursos science proposito machine interesse ! tipo educacao cientista unidades existem exemplo : sera trilhar colaborativo sc novos conosco unico completo pyspark empresa florestais area digital dia cumprindo duratex torna data simplifica busca atitude dividir decadas pessoa vida valorizados experiencia ceusa escala faz academicas centro pessoas , inscreva-se transforma aws similares sql oferecer ( acredita tornar anteriores completarmos 16 ia bi/analytics colombia lideranca time capitaneando saiba harmonica vividos lugar saibam portinari transformacao modelos todas desejaveis fabricas impulsiona representa industriais cadeira alinhado ciclo pb onde fortes seculo learning previas prazerosa desafio junto deca sempre `` viva porque meio preserva carreira plataforma consumidor castelatto design 3 lazer responsavel mudanca ) areas dando diferentes fazemos criacao mg desenvolvimento funcao criativas melhor tecnicos ainda cada importante marco jornada avancado continuar '' desenvolver soma cidades atende disseminar investimentos hard cultural buscamos dexco forma agora iniciaremos dispostas & marcas ; skills permitiu ensino colaborativa crenca experiencias proxima https durafloor queiram partem python caracteristicas especialista decora",cientista de dados,Não Informado
29, Grupo Connvert,cientista de dados senior,São Paulo,,https://www.glassdoor.com.br/partner/jobListing.htm?pos=211&ao=1136043&s=58&guid=0000018510b2c0289e6208656f1ca8dc&src=GD_JOB_AD&t=SR&vt=w&ea=1&cs=1_24680251&cb=1671022428486&jobListingId=1008207718206&jrtk=3-0-1gk8b5g39ii27801-1gk8b5g3rgfrt800-0ea199cf7ff9968d-,"ATIVIDADES:- Realizar programação, modelagem estatística e manipulação de base de dados relacionais;- Desenvolver e fazer a manutenção de modelos preditivos, de Risk Score, Credit Score e Behavior Score;- Analisar grandes volumes de dados e extrair deles insights que criem novas oportunidades de negócio;- Utilizar técnicas de machine learning e text mining para reconhecimento de padrões;- Colaborar na especificação de projetos de modelos estatísticos;- Implementar mecanismos de controle diários de indicadores operacionais;- Formular e analisar hipóteses que ajudem os clientes internos a tomar decisões estratégicas e táticas;- Pesquisar novas técnicas e metodologias em modelagem e testar sua aplicação no negócio;- Executar outras atividades correlatas de acordo com a solicitação da liderança.REQUISITOS:- Ensino Superior Completo em Matemática, Física, Estatística, Computação, Engenharia e/ou áreas afins;- Vivência com Análise de Dados;- Vivência com linguagens de definição e manipulação de dados (SQL, T-SQL, PL-SQL, etc);- Conhecimento de programação Python e/ou R;- Conhecimento de machine learning.LOCAL: Home Office;ESCALA: Segunda à sexta das 08:00 às 17:48.Tipo de vaga: Tempo integral, Efetivo CLTSalário: R$7.000,00 - R$9.000,00 por mêsBenefícios:Assistência médicaAssistência odontológicaAuxílio-crecheAuxílio-internetConvênios e descontos comerciaisTrabalho remotoVale-alimentaçãoVale-transporteHorário de trabalho:Horário flexívelTurno de 8 horasTipos de pagamento adicional:13º salárioMostrar mais Report",Não Informado,Não Informado,,Não Informado,Não Informado,,,,,,0,Não Informado,"preditivos 9.000,00 mecanismos afins vaga manutencao superior extrair indicadores correlatas metodologias office realizar projetos estatistica cltsalario fazer home atividades efetivo aplicacao tomar colaborar insights operacionais conhecimento trabalho mining padroes analise assistencia e/ou vivencia negocio novas 7.000,00 flexivelturno controle fisica diarios estrategicas ajudem dados tempo definicao comerciaistrabalho report medicaassistencia score pagamento computacao machine : taticas completo matematica linguagens internos estatisticos engenharia odontologicaauxilio-crecheauxilio-internetconvenios pl-sql escala mesbeneficios , grandes segunda sql ( - outras text etc modelos remotovale-alimentacaovale-transportehorario 17:48.tipo horario lideranca.requisitos adicional:13o testar salariomostrar learning clientes criem integral hipoteses implementar decisoes areas ) manipulacao learning.local descontos relacionais horastipos tecnicas r pesquisar executar credit desenvolver $ 08:00 modelagem especificacao volumes behavior oportunidades 8 t-sql formular ; ensino analisar risk acordo programacao sexta base solicitacao python utilizar reconhecimento",cientista de dados,senior
