67, Incentivar,cientista de dados pleno,São Paulo,4.2,https://www.glassdoor.com.br/partner/jobListing.htm?pos=326&ao=1136043&s=58&guid=0000018510b2ef8e86088d1227ce7d84&src=GD_JOB_AD&t=SR&vt=w&cs=1_3487106f&cb=1671022440611&jobListingId=1008256693846&jrtk=3-0-1gk8b5rtjj46q801-1gk8b5ru6jc9n800-ce8409c1aba5f4d2-,"O time de BI da Incentivar é um time autogerenciável, com autonomia para tomar decisões no dia a dia, e tem sua voz ouvida o tempo todo para que possamos aprender e se desenvolver juntos.
Esse profissional será responsável por gerar inteligência através dos dados, criação e gerenciamento dos relatórios e Dashboards, contribuir com a disseminação da cultura Data Driven, e com muito foco na automação de todas as atividades desempenhadas internamente.
Esse profissional também terá a responsabilidade de interagir, orientar e acompanhar os demais integrantes do time e de outras áreas sobre demandas e assuntos relacionados a BI, e manter-se atualizado sobre ferramentas e novidades do mercado para contribuir com a evolução da área e da empresa.
Responsabilidades e atribuições

Gerar Inteligência através dos dados;
Liderar e orientar os demais integrantes do time, se necessário;
Desenvolver e conduzir projetos de Data Science;
Ser o facilitador e disseminador da cultura data-driven
Identificar tendências e padrões em conjuntos de dados;
Alinhamentos sempre que necessário com os stakeholders, para manter as expectativas alinhadas;
Promover ações de cultura de dados através do desenvolvimento de variáveis e composição de informação dos serviços, conforme meta estratégica;
Modelar problemas complexos e identificar oportunidades por meio do uso de estatística, algoritmos, mineração de dados e técnicas de visualização que tragam resultados de negócios;
Construir, treinar e otimizar modelos utilizando técnicas de Machine Learning (Regressão linear, Árvore de decisão etc.);
Avaliação do Data Quality, Detecção de Outliers, Integrações e consistências de relatórios;
Acompanhar tendências do mercado, KPIs e estimativas, sugerindo otimizações.

Requisitos e qualificações

Estudos Mínimos: Ensino Superior/Técnico/Certificações;
Obrigatório – Inglês técnico;
Obrigatório – Power BI (DAX e M);
Obrigatório – Conhecimento de gestão de projetos AGILE e SCRUM
Obrigatório – Experiência com consulta em banco de dados MySQL;
Obrigatório – Conhecimento em ferramentas de ETL (Knime, Pentaho, DBT ou outras)
Obrigatório – Linguagem Python:
Obrigatório – Bibliotecas e frameworks: Jupyter, Numpy, Pandas, Matplotlib, Scikit-learn, LightGBM, CatBoost, PulP, Spark, Keras, Darts;
Obrigatório – Desenvolvimento: Git, GitHub, Docker;
Obrigatório – Conhecimentos em versionamento; acesso remoto; teste unitário;
Obrigatório – Fundamentos de computação em nuvem.
Obrigatório – Estatística básica: medidas de dispersão/posição;
Diferencial – Experiência de trabalho com projetos de engenharia e arquitetura de dados;
Diferencial – Experiencia em arquiteturas Data Lake;
Obrigatório – Familiaridade com APIs;
PRINCIPAIS SOFT SKILLS
Perfil analítico;
Crítico;
Proativo;
Pragmático;
Gestão de conflitos;
Gestão de tempo e organizado;
Ter senso de dono;
Ser apaixonado pelo problema.

Informações adicionais
Modelo de Trabalho:
Híbrido (2 dias presenciais no mês)
Para cuidar da sua saúde mental:
Terapia online: Através do App
Para apoiar seu dia a dia:
Benefício flexível (Cartão de benefício Caju): R$760,00 por mês
Para desenvolver sua carreira:
Auxílio EAD / Eventos / Cursos;
Avaliação de Desempenho;
Trilha de carreira estruturada;
Treinamentos frequentes;
A Incentivar é uma plataforma feita para engajar pessoas e ajudar empresas a usarem seus dados de forma estratégica e inteligente. Nosso app está nas mãos de mais de 20 mil colaboradores de grandes empresas como Cola-Cola FEMSA, iFood, Hypera Pharma, entre outras, ajudando todos a baterem mais metas e a serem reconhecidos por isso.
O produto da Incentivar é um SaaS, criado em 2019, e que vem sendo reconhecido pelo mercado como a solução de incentivo mais completa e versátil do país. Como primeira Incentivetech da América Latina, atuamos desde a apuração e geração de dados de performance até o acompanhamento de metas gamificadas, além de contarmos com um marketplace com mais de 1,2 milhões de prêmios para resgate e uma agência de comunicação interna que faz qualquer campanha de incentivo brilhar.
Somos uma startup de rápido crescimento, baseada em inovação, tecnologia e criatividade. Nosso foco sempre esteve e sempre estará nas pessoas. Apostar no protagonismo de quem faz tudo acontecer é parte do nosso DNA. Por isso, a incentivar é uma empresa inclusiva que preza pela diversidade dentro de seus quadros, inclusive nas lideranças.
Fazemos parte do ecossistema de startups do Cubo Itaú, onde respiramos inovação e estamos sempre em troca com as empresas mais disruptivas do mercado brasileiro.
Venha com a Incentivar construir o Incentivo Inteligente!Mostrar mais Report","São Paulo, Brasil",De 51 a 200 funcionários,,Prestação de serviço,Desconhecido/Não se aplica,3.8,2.4,3.7,4.3,3.6,75,Não Informado,"todo liderar informacao reconhecido otimizar alinhamentos consistencias troca projetos interagir estatistica dono ajudando versatil manter-se atividades serem hibrido tomar identificar eventos stakeholders conhecimento desde conhecimentos latina estruturada presenciais sugerindo requisitos liderancas milhoes estrategica quadros negocios tudo startup orientar numpy perfil online data integracoes frequentes empresas evolucao grandes ( automacao docker relatorios otimizacoes gestao etc mineracao sempre desempenho necessario carreira alem areas pragmatico criacao pentaho linguagem r quality demandas ifood desenvolver ouvida acesso engajar sendo vem pharma catboost linear aprender atraves cola-cola medidas servicos unitario scikit-learn avaliacao regressao deteccao campanha colaboradores parte integrantes modelo arquiteturas cultura arquitetura demais frameworks gamificadas usarem dashboards dias ter disseminador variaveis critico assuntos tempo inclusive dentro criatividade baterem problemas darts metas senso inteligente empresa tera ! apis engenharia app experiencia etl faz conforme bi resgate - tecnico analitico mostrar 1,2 modelos onde versionamento femsa mercado treinamentos plataforma hypera organizado decisoes desempenhadas kpis fazemos cartao sobre promover dispersao/posicao lake apuracao $ preza inclusiva acontecer arvore construir complexos ensino decisao treinar acoes visualizacao caju fundamentos crescimento juntos 2 power . tragam problema atribuicoes dna algoritmos premios atualizado apaixonado banco respiramos internamente novidades ingles incentivetech superior/tecnico/certificacoes mental venha alinhadas acompanhamento disruptivas produto estudos science comunicacao machine geracao : sera basica area utilizando dia bibliotecas ead brilhar spark rapido cubo conflitos pais apoiar time matplotlib terapia todas conjuntos gerenciamento learning driven teste dbt familiaridade apostar disseminacao responsavel jupyter primeira desenvolvimento feita knime incentivar saude profissional git forma beneficio gerar startups todos saas composicao marketplace america python ajudar qualificacoes agile agencia pulp incentivo tambem responsabilidades qualquer autonomia meta reconhecidos soft 2019 uso obrigatorio itau estara github contribuir mysql inovacao solucao brasileiro manter 20 performance tecnologia trabalho m pandas possamos consulta padroes lightgbm dax tendencias relacionados expectativas inteligencia outliers diversidade dados ecossistema mes trilha report proativo cursos scrum computacao diferencial atuamos foco autogerenciavel facilitador informacoes keras completa pessoas , maos voz outras resultados cuidar / adicionais baseada 760,00 protagonismo meio ate ) ferramentas tecnicas contarmos auxilio responsabilidade interna data-driven oportunidades conduzir principais remoto minimos ; skills mil criado nuvem acompanhar estimativas modelar flexivel",cientista de dados,pleno
68, Mollica RH,cientista de dados juniorestagio,Rio de Janeiro,4.8,https://www.glassdoor.com.br/partner/jobListing.htm?pos=311&ao=1136043&s=58&guid=0000018510b2ef8e86088d1227ce7d84&src=GD_JOB_AD&t=SR&vt=w&cs=1_5d067d9b&cb=1671022440610&jobListingId=1007179112949&jrtk=3-0-1gk8b5rtjj46q801-1gk8b5ru6jc9n800-2816a3c9319a56cd-,"DESCRIÇÃO:
Apoiar no desenvolvimento de projetos de dados, aprendizagem de máquina, BI e práticas adjacentes.

Requisitos:
– Graduado ou graduando em ciências da computação, matemática aplicada, engenharia ou áreas afins;
– Facilidade para programação e algum conhecimento em Python;
– Background acadêmico em Cálculo, Álgebra Linear, Estatística & Programação;

Desejável:
– Experiência com Power BI & BIs de forma geral;
– Experiência com Python, Pandas, Tensorflow, Scikit;
– Experiência com R e outras linguagens de programação;
– Experiência com Web (protocolo HTTP, HTML, CSS, JavaScript, serviços REST);
– Experiência com aprendizagem de máquina, processamento da dados, ETLs, dashboarding e análise de dados;
– Experiência com pesquisa operacional e modelos de otimização

Período: Indeterminado
Modelo de contratação: Estágio/ PJ/ CLT
Local: Rio de Janeiro, RJ – Disponibilidade mínima de 30h por semana.

Qualquer dúvida, acionar taina@mollicait.comMostrar mais Report","São Paulo, Brasil",De 1 a 50 funcionários,2014.0,Empresa – capital fechado,De US$ 1 a US$ 5 milhões,4.7,4.4,4.9,4.7,4.7,100,Tecnologia da informação,"operacional semana afins algum servicos power desejavel . qualquer projetos estatistica @ protocolo modelo aplicada contratacao background academico conhecimento acionar http calculo pandas pj/ analise rj estagio/ otimizacao disponibilidade requisitos dados rio report bis computacao descricao janeiro adjacentes mollicait.commostrar : facilidade css matematica rest indeterminado linguagens engenharia experiencia ciencias graduando , bi ( - dashboarding outras apoiar html periodo taina modelos tensorflow etls clt 30h maquina web graduado areas ) desenvolvimento aprendizagem scikit javascript r geral duvida algebra forma ; & minima praticas pesquisa programacao local processamento python linear",cientista de dados,junior
69, Fator WoW!,cientista de dados pleno,Matias Barbosa,5.0,https://www.glassdoor.com.br/partner/jobListing.htm?pos=323&ao=1136043&s=58&guid=0000018510b2ef8e86088d1227ce7d84&src=GD_JOB_AD&t=SR&vt=w&cs=1_7e1be39c&cb=1671022440611&jobListingId=1007879997711&jrtk=3-0-1gk8b5rtjj46q801-1gk8b5ru6jc9n800-91a944320a2452a0-,"Nível: Analista
Cursos de: Administração,Engenharia de produção,Tecnologia da informação,Tecnologia em Gestão Pública,Administração com habilitação em administração de empresas,Administração de empresas,Informática para Gestão de Negócios ,Gestão da Tecnologia da Informação,Tecnologia em Processos Gerenciais,Ciências de Dados
Escolaridade: Graduação - Administração, Engenharia de Produção e Tecnologia da Informação - Completo
Tipo de contrato: CLT
Jornada de trabalho: SEG A SEX: 08:00 até 18:00

Benefícios: Day-off no seu aniversário, Bonificação por resultado, Benefício Flexível de R$ 22,00

Responsabilidades e Experiências desejáveis:PRINCIPAIS ATIVIDADES:
Construir, treinar, revisar, adaptar modelos de Machine Learning aplicados a cenários como: discador telefônico inteligente, análise de humor através de texto e voz, aderência à scripts por parte dos agentes, etc;
Implantar e implementar os modelos juntamente da programação dentro do produto atual da empresa: uma plataforma omnichannel de comunicação B2B2C;

REQUISITOS:
Formação em Engenharias, Estatística e Ciência da Computação;
Domínio de Estatística e Machine Learning incluindo os principais modelos de aprendizado supervisionado como modelos de classificação, regressão, etc;
Domínio da linguagem Python e bibliotecas relacionadas como Pandas, Tensor Flow, etc;
Domínio das ferramentas AWS aplicadas à Machine Learning;
Domínio de modelagem e implementação de bancos de dados relacionais e não-relacionais.

PRINCIPAIS COMPORTAMENTOS:
Comunicação assertiva;
Vontade continua de aprendizado.

Analista

1 anoMostrar mais Report","Vitória, Brasil",Desconhecido,,Empresa – capital fechado,Desconhecido/Não se aplica,3.0,1.0,1.0,3.0,3.0,0,Não Informado,"atraves informacao classificacao producao discador cenarios regressao responsabilidades agentes sex . continua omnichannel estatistica parte implantar aderencia adaptar incluindo atividades tecnologia trabalho escolaridade beneficios pandas analista analise informatica dominio publica produto requisitos dados report humor dentro cursos negocios comunicacao computacao machine flow tipo revisar implementacao : scripts completo inteligente atual empresa formacao bibliotecas texto b2b2c 18:00 engenharia aplicadas comportamentos aprendizado nivel empresas ciencias , engenharias aws relacionadas - voz administracao ciencia seg gestao processos etc aniversario modelos desejaveis 22,00 bancos clt gerenciais bonificacao learning supervisionado habilitacao day-off aplicados graduacao plataforma ate implementar vontade ferramentas telefonico relacionais linguagem anomostrar r jornada $ 08:00 modelagem nao-relacionais assertiva 1 construir principais beneficio ; resultado juntamente experiencias programacao tensor treinar contrato python flexivel",cientista de dados,pleno
70, Energisa - Recrutamento Externo,esp cientista dados,Rio de Janeiro,4.2,https://www.glassdoor.com.br/partner/jobListing.htm?pos=303&ao=1136043&s=58&guid=0000018510b2ef8e86088d1227ce7d84&src=GD_JOB_AD&t=SR&vt=w&ea=1&cs=1_e1a54c86&cb=1671022440609&jobListingId=1008263396603&jrtk=3-0-1gk8b5rtjj46q801-1gk8b5ru6jc9n800-20d0cca0b002c4c2-,"Somos uma das principais empresas privadas do setor elétrico, com 19 mil colaboradores próprios e terceiros de norte a sul do Brasil iluminando vidas, transformando energia em conforto e desenvolvimento. Atendemos 25% do território nacional com quase 8 milhões de clientes, com ações na bolsa de valores entre as mais bem avaliadas do setor elétrico. Buscar soluções energéticas inovadoras e sustentáveis está no DNA dessa gente que brilha e se orgulha de fazer um trabalho transformador. Buscamos pessoas que assim como a gente, possuam espírito de realização, inovação e que queiram construir um trabalho que faça a diferença para milhares de pessoas.
Se você se identifica com os desafios e busca incessantemente a excelência e o crescimento contínuo, no Grupo Energisa você tem a oportunidade de transformar a sua carreira.
Você será responsável por:
Responsável por planejar e executar iniciativas de Advanced Analytics/Artificial Intelligence (AA/AI) para implantação de soluções sistêmicas (preditivas e prescritivas), baseadas em métodos, técnicas e algoritmos de Artificial Intelligence, Machine Learning, Deep Learning e/ou Otimização.
Apoiar e suportar as diferentes áreas de negócio da empresa, impulsionando a cultura data-driven.
Elaborar reports sobre estudos, análises e resultados referentes aos modelos de inferência desenvolvidos, sendo referência como especialista nessas soluções.
Interagir diretamente com a área de Engenharia de Dados, visando obter a orientação e o suporte necessários ao desenvolvimento dos produtos data-driven.
Desenvolver melhorias constantes das técnicas aplicadas aos modelos preditivos e prescritivos, incluindo planejar e elaborar novos relatórios e relatórios customizados às necessidades dos clientes das áreas de negócio.
Participar do estudo de novas oportunidades estratégicas para o grupo que podem ser suportadas por soluções de AA/AI.
Realizar apresentações orais, para os níveis operacional e executivo, sobre os projetos, análises e estudos sob sua responsabilidade.
Reportar, periodicamente a seus superiores, o andamento das atividades e dos produtos.
Executar outras tarefas de mesma natureza e nível de complexidade, como por exemplo, análises descritivas.
Interagir diretamente com a área de Engenharia de Dados, visando obter a orientação e o suporte necessários ao desenvolvimento dos produtos baseados em soluções de AA/AI.
O que é essencial você apresentar:
Conhecimento e experiência nos fundamentos específicos de Artificial Intelligence, Machine Learning, Deep Learning, Otimização, Processos Estocásticos, Teoria das Probabilidades, Inferência e Estatística Multivariada.
Capacidade de interpretar os resultados e avaliar a adequação teórica das soluções desenvolvidas, gerando informações confiáveis e com embasamento teórico para tomada de decisão.
Capacidade de comunicação oral e escrita, e de condução de sessões conjuntas de levantamento de necessidades junto às áreas de negócio.
Habilidade na comunicação de conceitos analíticos complexos para pessoas de outras áreas de atuação.
Estar atento para identificar oportunidades de negócio através dos dados e propor novas soluções.
Formação em: Estatística, Engenharia, Ciência da Computação, Economia, Matemática ou correlatas.
Inglês fluente
O que oferecemos:
Plano de saúde e seguro de vida;
Plano odontológico;
Previdência privada;
Participação nos lucros;
Vale alimentação ou refeição;
Auxílio Creche;
Programas de qualidade de vida;
Gympass que te dá acesso a mais de 18 mil academias no Brasil.
Acreditamos na força da diversidade para gerar inovação e atingir resultados incríveis. Dessa forma, todas as candidaturas realizadas são consideradas sem distinção de raça, religião, gênero, nacionalidade, deficiência, orientação sexual, idade ou qualquer outra.
#vemserenergisaMostrar mais Report","Cataguases, Brasil",Mais de 10.000 funcionários,1905.0,Empresa – capital fechado,Desconhecido/Não se aplica,3.8,4.0,4.2,3.7,3.7,88,"Energia, mineração, utilitários","impulsionando atraves fundamentos solucoes preditivos diferenca operacional descritivas oferecemos crescimento academias outra confiaveis transformador correlatas multivariada . qualquer conceitos realizar essencial avaliadas interagir projetos colaboradores estatistica sustentaveis sessoes participacao deficiencia dna atendemos constantes atingir preditivas teorico norte incluindo participar vale fazer algoritmos faca desenvolvidas brilha sistemicas cultura atividades implantacao probabilidades voce estudo apresentar deep niveis inovacao desenvolvidos terceiros avaliar identificar valores raca conhecimento qualidade vidas trabalho ingles seguro brasil incriveis melhorias atento odontologico prescritivos atuacao habilidade sao buscar religiao e/ou superiores otimizacao diversidade negocio 25 novas fluente programas vemserenergisamostrar inferencia realizadas estrategicas produtos suportadas dados gerando sexual milhoes grupo % estudos report 19 teoria nacional identifica suporte lucros comunicacao computacao territorio machine escrita iluminando especialista exemplo conforto : realizacao sera 18 privadas novos obter tomada propor genero empresa formacao area matematica tarefas gympass informacoes busca conjuntas mesma analytics/artificial engenharia aplicadas bem elaborar reports plano vida sul empresas nivel experiencia orgulha pessoas , inovadoras interpretar ( estocasticos orais relatorios executivo outras ciencia complexidade apoiar resultados diretamente transformando baseadas necessidades processos iniciativas necessarios economia analiticos candidaturas orientacao assim modelos especificos teorica todas idade prescritivas referentes previdencia eletrico milhares learning junto andamento customizados clientes referencia carreira intelligence creche excelencia energisa dessa advanced alimentacao refeicao responsavel periodicamente ) areas natureza diferentes aa/ai desenvolvimento sobre capacidade apresentacoes metodos tecnicas # quase bolsa auxilio executar responsabilidade planejar espirito nessas conducao privada embasamento data-driven setor desenvolver nacionalidade saude proprios visando buscamos analises acesso oportunidades sendo 8 transformar construir energia forma principais possuam gerar consideradas complexos ; energeticas acreditamos suportar gente oportunidade distincao podem oral mil sob adequacao reportar baseados decisao queiram incessantemente continuo artificial desafios levantamento acoes forca",cientista de dados,Não Informado
71, Takao,cientista de dados,São Paulo,3.7,https://www.glassdoor.com.br/partner/jobListing.htm?pos=307&ao=1136043&s=58&guid=0000018510b2ef8e86088d1227ce7d84&src=GD_JOB_AD&t=SR&vt=w&cs=1_4369cc52&cb=1671022440609&jobListingId=1008197007613&jrtk=3-0-1gk8b5rtjj46q801-1gk8b5ru6jc9n800-349178cd7b1aaa05-,"Já pensou em trabalhar em um lugar em constante transformação, inovação, colaboração e crescimento?
Aqui na Goop é o lugar!
Quem somos?

Somos a Goop!
Nossa marca Takao é uma das mais fortes do segmento de peças para motores no Brasil! Nosso propósito é ser a solução completa para manutenção e reposição automotiva. Procuramos pessoas engajados em melhorar a experiência de nossos clientes. Estamos falando de uma empresa que cresce mais de 30% ao ano!
Nosso time é especializado no que faz, desde o desenvolvimento da peça até o pós-vendas.
Por aqui trabalhamos com graxa na veia. Nosso negócio é feito de garra, ousadia, olho no olho e alta performance. Somos diferentes!

Se você gosta de aprender e reaprender todos os dias em um ambiente que respeita quem você é, reconhece as suas habilidades e promove o seu desenvolvimento então aqui é o seu lugar.
Você será o responsável por analisar os dados e desenvolver modelos descritivos e preditivos para acelerar o nosso crescimento!
O seu desafio será identificar oportunidades e trazer inteligência para vendermos mais!
Responsabilidades e atribuições
O que esperamos de você?
Desenvolvimento e manutenção de modelos descritivos e preditivos utilizando técnicas e práticas de Machine Learning, especialmente Python como linguagem de programação;
Utilização de dados em nuvem para análises e geração de insights, em especial dentro de empresa de venda de produtos;
Criação e manutenção de serviços para ampliar a nossa performance, tais como detecções de anomalias, algoritmos de propensão de compra, dentre outros;
Conhecimento profundo e prático, preferencialmente envolvendo cursos na área, das técnicas, práticas e frameworks que envolvam Machine Learning. Desenvolvimento de modelos preditivos utilizando conhecimentos da área;
Experiência prática na aplicação dos conceitos e ferramentas, utilizando PYTHON como linguagem principal, para produção de análises, reports e estudos. Deploy de modelos em ambientes de cloud, como Google Cloud Platform (GCP) (Desejável);
Expertise na construção de modelos descritivos e preditivos para análise de comportamento de usuários, utilizando métricas de vendas e/ou e-commerce e/ou aplicativo (Desejável);
Diferenciais: Operação e arquitetura de Data Lakes, especialmente utilizando a infraestrutura de cloud do Google como Big Query, DataFlow, dentre outros serviços;

Requisitos e qualificações

Python;
Machine Learning;
Construção de modelos descritivos e preditivos;
Linguagem SQL;
Diferenciais: Big Query, DataFlow e GCP;

Informações adicionais
Estamos em regime híbrido!
Ou seja, de segunda e sexta estamos em home office e terça, quarta e quinta na empresa presencial.
Nossa marca é uma das mais fortes do segmento de peças para motores no Brasil! Nosso propósito é ser a solução completa para manutenção e reposição automotiva. Procuramos pessoas engajados em melhorar a experiência de nossos clientes. Estamos falando de uma empresa que cresce mais de 30% ao ano!
Nosso time é especializado no que faz, desde o desenvolvimento da peça até o pós-vendas.
Por aqui trabalhamos com graxa na veia. Nosso negócio é feito de garra, ousadia, olho no olho e alta performance. Somos diferentes!Mostrar mais Report","Santa Monica, CA",De 201 a 500 funcionários,2008.0,Empresa – capital fechado,Desconhecido/Não se aplica,2.9,3.4,3.3,2.8,3.0,73,Serviços pessoais do consumidor,"aprender preditivos producao qualificacoes trabalhar crescimento servicos manutencao preferencialmente responsabilidades ambiente office desejavel . colaboracao segmento conceitos gosta pos-vendas atribuicoes aplicativo construcao deteccoes algoritmos home melhorar tais procuramos arquitetura voce vendas falando aplicacao inovacao principal hibrido solucao veia feito identificar performance insights frameworks conhecimento desde ano conhecimentos brasil constante dias cresce analise metricas pratico cloud regime takao garra e/ou inteligencia aqui negocio marca vendermos graxa requisitos produtos ambientes reconhece dados dentre habilidades expertise query % report estudos ja pecas dentro envolvendo cursos proposito dataflow machine geracao motores especialmente : sera anomalias engajados empresa utilizando ! esperamos area platform data especial informacoes outros venda quarta reports completa reaprender automotiva experiencia terca faz pessoas , entao segunda ousadia sql ( utilizacao comportamento trazer time mostrar olho peca lugar transformacao modelos adicionais big presencial pratica lakes fortes desafio learning clientes acelerar operacao ate 30 pensou descritivos google diferenciais profundo responsavel promove ) ferramentas diferentes desenvolvimento criacao tecnicas goop linguagem trabalhamos respeita quinta especializado desenvolver deploy usuarios propensao analises oportunidades gcp e-commerce ; reposicao ? analisar alta todos praticas compra programacao sexta nuvem envolvam python infraestrutura ampliar",cientista de dados,Não Informado
